{
  "authoritative_native_entries": [
    {
      "build_context_id": "code-c-pyinstaller-93c78704c64e5063889df2aebd1981c5",
      "disposition": "EXTERNAL_PREREQUISITE",
      "entry_id": "selected-0001-4ed632af949e",
      "external_prerequisite": {
        "capability": "msvcp140_1.dll",
        "manifest_sha256": "c3dd16982ee2c406aa3795aabc2e18ba3870125f861fea7a06f75111449ebe3b",
        "prerequisite_id": "microsoft-vc-v14-x64-14.51.36247.0",
        "provider_id": "microsoft-vc-redist-x64-14.51.36247.0"
      },
      "internal_path": "MSVCP140_1.dll",
      "owner_kind": "SYSTEM_BUILD_RUNTIME_NATIVE",
      "payload_sha256": "206c931bf90fdad8816de3b5e2ef80b2bcaa9406c89ecc05fe6fddffe251e982",
      "pyinstaller_category": "BINARY",
      "pyinstaller_stage": "ANALYSIS_TOC",
      "required_in_final": false,
      "resolution_basis": "CURRENT_PE_IMPORT_CLOSURE_AND_EXTERNAL_PREREQUISITE_MANIFEST",
      "source_artifact_id": "external-observation-206c931bf90fdad8816de3b5e2ef80b2bcaa9406c89ecc05fe6fddffe251e982",
      "source_artifact_sha256": "206c931bf90fdad8816de3b5e2ef80b2bcaa9406c89ecc05fe6fddffe251e982",
      "source_path": "windows/C/Windows/System32/MSVCP140_1.dll",
      "target": {
        "architecture": "x86_64",
        "os": "windows",
        "python_version": "3.13.15"
      }
    },
    {
      "build_context_id": "code-c-pyinstaller-93c78704c64e5063889df2aebd1981c5",
      "entry_id": "selected-0002-9ba4dd0e98bd",
      "internal_path": "PIL/_avif.cp313-win_amd64.pyd",
      "owner_kind": "WHEEL_OWNED_NATIVE",
      "payload_sha256": "2e3e5cce3aea38c603680ca3da5d161fad123ce23a803bb692a56aff608989be",
      "pyinstaller_category": "EXTENSION",
      "pyinstaller_stage": "PKG_TOC",
      "required_in_final": true,
      "resolution_basis": "PAYLOAD_SHA256_AND_SELECTED_SOURCE_PATH",
      "source_artifact_id": "wheel-pkg:pypi-pillow-12.3.0",
      "source_artifact_sha256": "1cca606cd25738df4ed873d5ad46bbdb3d83b5cbca291f6b4ff13a4df6b0bbe8",
      "source_path": "PIL/_avif.cp313-win_amd64.pyd",
      "target": {
        "architecture": "x86_64",
        "os": "windows",
        "python_version": "3.13.15"
      }
    },
    {
      "build_context_id": "code-c-pyinstaller-93c78704c64e5063889df2aebd1981c5",
      "entry_id": "selected-0003-3a71eddb05a8",
      "internal_path": "PIL/_imaging.cp313-win_amd64.pyd",
      "owner_kind": "WHEEL_OWNED_NATIVE",
      "payload_sha256": "88756e8e0e3f6180e518da25d379597c861e2d20d716ef001894789b515c1777",
      "pyinstaller_category": "EXTENSION",
      "pyinstaller_stage": "PKG_TOC",
      "required_in_final": true,
      "resolution_basis": "PAYLOAD_SHA256_AND_SELECTED_SOURCE_PATH",
      "source_artifact_id": "wheel-pkg:pypi-pillow-12.3.0",
      "source_artifact_sha256": "1cca606cd25738df4ed873d5ad46bbdb3d83b5cbca291f6b4ff13a4df6b0bbe8",
      "source_path": "PIL/_imaging.cp313-win_amd64.pyd",
      "target": {
        "architecture": "x86_64",
        "os": "windows",
        "python_version": "3.13.15"
      }
    },
    {
      "build_context_id": "code-c-pyinstaller-93c78704c64e5063889df2aebd1981c5",
      "entry_id": "selected-0004-f7855ee27740",
      "internal_path": "PIL/_imagingcms.cp313-win_amd64.pyd",
      "owner_kind": "WHEEL_OWNED_NATIVE",
      "payload_sha256": "7ecb50b954d13d72b7a0ff565872332443cdbc83a36e58a56b2b949a56f32549",
      "pyinstaller_category": "EXTENSION",
      "pyinstaller_stage": "PKG_TOC",
      "required_in_final": true,
      "resolution_basis": "PAYLOAD_SHA256_AND_SELECTED_SOURCE_PATH",
      "source_artifact_id": "wheel-pkg:pypi-pillow-12.3.0",
      "source_artifact_sha256": "1cca606cd25738df4ed873d5ad46bbdb3d83b5cbca291f6b4ff13a4df6b0bbe8",
      "source_path": "PIL/_imagingcms.cp313-win_amd64.pyd",
      "target": {
        "architecture": "x86_64",
        "os": "windows",
        "python_version": "3.13.15"
      }
    },
    {
      "build_context_id": "code-c-pyinstaller-93c78704c64e5063889df2aebd1981c5",
      "entry_id": "selected-0005-6ec61ba4b0aa",
      "internal_path": "PIL/_imagingmath.cp313-win_amd64.pyd",
      "owner_kind": "WHEEL_OWNED_NATIVE",
      "payload_sha256": "9d5bbea6a877a48ed7995a0640ecb0a5567d9fad544a4a1fbf9f22d507029b57",
      "pyinstaller_category": "EXTENSION",
      "pyinstaller_stage": "PKG_TOC",
      "required_in_final": true,
      "resolution_basis": "PAYLOAD_SHA256_AND_SELECTED_SOURCE_PATH",
      "source_artifact_id": "wheel-pkg:pypi-pillow-12.3.0",
      "source_artifact_sha256": "1cca606cd25738df4ed873d5ad46bbdb3d83b5cbca291f6b4ff13a4df6b0bbe8",
      "source_path": "PIL/_imagingmath.cp313-win_amd64.pyd",
      "target": {
        "architecture": "x86_64",
        "os": "windows",
        "python_version": "3.13.15"
      }
    },
    {
      "build_context_id": "code-c-pyinstaller-93c78704c64e5063889df2aebd1981c5",
      "entry_id": "selected-0006-8b61aa5c70ad",
      "internal_path": "PIL/_imagingtk.cp313-win_amd64.pyd",
      "owner_kind": "WHEEL_OWNED_NATIVE",
      "payload_sha256": "8ccd6128481d5a3a15993c2f8a69585694ff972652a6b06dcaee276fc65633a7",
      "pyinstaller_category": "EXTENSION",
      "pyinstaller_stage": "PKG_TOC",
      "required_in_final": true,
      "resolution_basis": "PAYLOAD_SHA256_AND_SELECTED_SOURCE_PATH",
      "source_artifact_id": "wheel-pkg:pypi-pillow-12.3.0",
      "source_artifact_sha256": "1cca606cd25738df4ed873d5ad46bbdb3d83b5cbca291f6b4ff13a4df6b0bbe8",
      "source_path": "PIL/_imagingtk.cp313-win_amd64.pyd",
      "target": {
        "architecture": "x86_64",
        "os": "windows",
        "python_version": "3.13.15"
      }
    },
    {
      "build_context_id": "code-c-pyinstaller-93c78704c64e5063889df2aebd1981c5",
      "entry_id": "selected-0007-5c1319b0ebb1",
      "internal_path": "PIL/_webp.cp313-win_amd64.pyd",
      "owner_kind": "WHEEL_OWNED_NATIVE",
      "payload_sha256": "9918faf8d90faa86e03e48479c6a62383be71da759254afded18591a406a92fe",
      "pyinstaller_category": "EXTENSION",
      "pyinstaller_stage": "PKG_TOC",
      "required_in_final": true,
      "resolution_basis": "PAYLOAD_SHA256_AND_SELECTED_SOURCE_PATH",
      "source_artifact_id": "wheel-pkg:pypi-pillow-12.3.0",
      "source_artifact_sha256": "1cca606cd25738df4ed873d5ad46bbdb3d83b5cbca291f6b4ff13a4df6b0bbe8",
      "source_path": "PIL/_webp.cp313-win_amd64.pyd",
      "target": {
        "architecture": "x86_64",
        "os": "windows",
        "python_version": "3.13.15"
      }
    },
    {
      "build_context_id": "code-c-pyinstaller-93c78704c64e5063889df2aebd1981c5",
      "entry_id": "selected-0008-9a88f31a7a70",
      "internal_path": "_asyncio.pyd",
      "owner_kind": "CPYTHON_TOOLCHAIN_NATIVE",
      "payload_sha256": "6941e2aeed3aad1a4658774ecb60309170066a040c2118a5efd16458ac3bed00",
      "pyinstaller_category": "EXTENSION",
      "pyinstaller_stage": "PKG_TOC",
      "required_in_final": true,
      "resolution_basis": "SELECTED_SOURCE_PATH_UNDER_LOCKED_CPYTHON_PREFIX",
      "source_artifact_id": "cpython-3.13.15-windows-x86_64",
      "source_artifact_sha256": "edec09c4853aeae9ac36efb8c9f95b6b8e2fee65eee56d9767a8b7c69c574403",
      "source_path": "DLLs/_asyncio.pyd",
      "target": {
        "architecture": "x86_64",
        "os": "windows",
        "python_version": "3.13.15"
      }
    },
    {
      "build_context_id": "code-c-pyinstaller-93c78704c64e5063889df2aebd1981c5",
      "entry_id": "selected-0009-7151c982de5b",
      "internal_path": "_bz2.pyd",
      "owner_kind": "CPYTHON_TOOLCHAIN_NATIVE",
      "payload_sha256": "261545bd24f15a783fc0c82568b766a4ab569dde14507a81701cccf5293e6e54",
      "pyinstaller_category": "EXTENSION",
      "pyinstaller_stage": "PKG_TOC",
      "required_in_final": true,
      "resolution_basis": "SELECTED_SOURCE_PATH_UNDER_LOCKED_CPYTHON_PREFIX",
      "source_artifact_id": "cpython-3.13.15-windows-x86_64",
      "source_artifact_sha256": "edec09c4853aeae9ac36efb8c9f95b6b8e2fee65eee56d9767a8b7c69c574403",
      "source_path": "DLLs/_bz2.pyd",
      "target": {
        "architecture": "x86_64",
        "os": "windows",
        "python_version": "3.13.15"
      }
    },
    {
      "build_context_id": "code-c-pyinstaller-93c78704c64e5063889df2aebd1981c5",
      "entry_id": "selected-0010-fadf84113f6c",
      "internal_path": "_ctypes.pyd",
      "owner_kind": "CPYTHON_TOOLCHAIN_NATIVE",
      "payload_sha256": "9d6dccb4cd84a44a107f9b06b91c0a44e85766d9bf4debb6abbde8fda7494c2c",
      "pyinstaller_category": "EXTENSION",
      "pyinstaller_stage": "PKG_TOC",
      "required_in_final": true,
      "resolution_basis": "SELECTED_SOURCE_PATH_UNDER_LOCKED_CPYTHON_PREFIX",
      "source_artifact_id": "cpython-3.13.15-windows-x86_64",
      "source_artifact_sha256": "edec09c4853aeae9ac36efb8c9f95b6b8e2fee65eee56d9767a8b7c69c574403",
      "source_path": "DLLs/_ctypes.pyd",
      "target": {
        "architecture": "x86_64",
        "os": "windows",
        "python_version": "3.13.15"
      }
    },
    {
      "build_context_id": "code-c-pyinstaller-93c78704c64e5063889df2aebd1981c5",
      "entry_id": "selected-0011-f1e23bfc3abe",
      "internal_path": "_decimal.pyd",
      "owner_kind": "CPYTHON_TOOLCHAIN_NATIVE",
      "payload_sha256": "1e6a5707163d3c103e0eb4695eefedbea4b855fb227c61cc265b168970d6c6f0",
      "pyinstaller_category": "EXTENSION",
      "pyinstaller_stage": "PKG_TOC",
      "required_in_final": true,
      "resolution_basis": "SELECTED_SOURCE_PATH_UNDER_LOCKED_CPYTHON_PREFIX",
      "source_artifact_id": "cpython-3.13.15-windows-x86_64",
      "source_artifact_sha256": "edec09c4853aeae9ac36efb8c9f95b6b8e2fee65eee56d9767a8b7c69c574403",
      "source_path": "DLLs/_decimal.pyd",
      "target": {
        "architecture": "x86_64",
        "os": "windows",
        "python_version": "3.13.15"
      }
    },
    {
      "build_context_id": "code-c-pyinstaller-93c78704c64e5063889df2aebd1981c5",
      "entry_id": "selected-0012-425a74357434",
      "internal_path": "_elementtree.pyd",